{
  "type": "object",
  "$schema": "http://json-schema.org/draft-04/schema#",
  "description": "Resource Index event body",
  "properties": {
    "id": {
      "description": "Resource id",
      "type": "string"
    },
    "type": {
      "description": "Resource Index event operation type",
      "$ref": "resourceIndexEventType.json"
    },
    "tenant": {
      "description": "Tenant id",
      "type": "string"
    },
    "ts": {
      "description": "Message timestamp",
      "type": "string"
    },
    "resourceName": {
      "description": "Name of resource",
      "type": "string"
    },
    "new": {
      "description": "Resource record new fields",
      "type": "object"
    },
    "old": {
      "description": "Resource record old fields",
      "type": "object"
    }
  },
  "x-implements": "org.folio.spring.tools.kafka.BaseKafkaMessage"
}
